{
  "artifact_type": "pilot_research_ledger",
  "schema_version": "1.0.0",
  "producer_version": "0.5.0",
  "rule_version": "narrative-lifecycle-rules-v0.1",
  "run_id": "run_20260713T035113631_508dfa",
  "generated_at": "2026-07-13T03:51:14.089Z",
  "ledger_id": "research_ledger_run_20260713T035113631_508dfa",
  "status": "ok",
  "source_artifacts": [
    "outputs/runs/latest_run.json",
    "outputs/reports/weekly_brief.json",
    "outputs/diffs/latest_stage_diff.json",
    "outputs/reviews/latest_operator_review.json",
    "data/pilot/pilot_topics.yaml",
    "data/pilot/operator_observations.yaml"
  ],
  "pilot_topic_count": 10,
  "ledger_entries": [
    {
      "topic_id": "bci",
      "current_hypothesis": "脑机接口 BCI remains in S4 until new evidence changes the persisted artifacts.",
      "competing_hypothesis": "脑机接口 BCI may be a narrower branch event rather than a parent narrative transition.",
      "current_stage": "S4",
      "prior_band": "medium",
      "posterior_direction": "unchanged",
      "event_intensity": "medium",
      "tail_structure": "normal",
      "strongest_evidence_ids": [
        "bci_parent_label",
        "bci_parent_capital",
        "bci_branch_label_pricing",
        "bci_e001",
        "import_bci_medical_rehab_followup_001"
      ],
      "why_not_higher_stage": "Upgrade is capped by required checks: old theme reactivation; branch reality upgrade; pricing adoption insufficient; parent reality insufficient; medical branch validation cannot represent whole BCI; revenue/payment/listed-asset mapping still missing.",
      "falsification_trigger": "New persisted evidence contradicts the current stage or removes a required Stage Gate layer.",
      "next_validation_window": "4-6 weeks",
      "operator_agreement": "uncertain",
      "operator_comment": "Initial pilot seed; awaiting operator review.",
      "outcome_status": "pending",
      "latest_artifact_stage": "S4",
      "diff_change_type": "no_change",
      "diff_detected_changes": [
        "no_change"
      ],
      "branch_mutation_detected": false,
      "missed_change_detected": false,
      "artifact_evidence_ids": [
        "bci_parent_label",
        "bci_parent_capital",
        "bci_branch_label_pricing",
        "bci_e001",
        "import_bci_medical_rehab_followup_001"
      ],
      "research_only_action": "wait",
      "status_note": "No change is a valid pilot state; continue the validation window."
    },
    {
      "topic_id": "humanoid_robotics",
      "current_hypothesis": "人形机器人 / 具身智能 remains in S5-S6 until new evidence changes the persisted artifacts.",
      "competing_hypothesis": "人形机器人 / 具身智能 may be a narrower branch event rather than a parent narrative transition.",
      "current_stage": "S5-S6",
      "prior_band": "medium",
      "posterior_direction": "unchanged",
      "event_intensity": "medium",
      "tail_structure": "normal",
      "strongest_evidence_ids": [
        "humanoid_parent_label",
        "humanoid_parent_capital",
        "humanoid_parent_pricing",
        "humanoid_parent_reality",
        "humanoid_e001"
      ],
      "why_not_higher_stage": "Upgrade is capped by required checks: pricing adoption; reality validation; valuation friction; S7A/S7C potential; S7B risk for crowded edge assets.",
      "falsification_trigger": "New persisted evidence contradicts the current stage or removes a required Stage Gate layer.",
      "next_validation_window": "4-6 weeks",
      "operator_agreement": "uncertain",
      "operator_comment": "Initial pilot seed; awaiting operator review.",
      "outcome_status": "pending",
      "latest_artifact_stage": "S5-S6",
      "diff_change_type": "no_change",
      "diff_detected_changes": [
        "no_change"
      ],
      "branch_mutation_detected": false,
      "missed_change_detected": false,
      "artifact_evidence_ids": [
        "humanoid_parent_label",
        "humanoid_parent_capital",
        "humanoid_parent_pricing",
        "humanoid_parent_reality",
        "humanoid_e001"
      ],
      "research_only_action": "wait",
      "status_note": "No change is a valid pilot state; continue the validation window."
    },
    {
      "topic_id": "innovative_drug_license_out",
      "current_hypothesis": "创新药 License-out remains in S5-S6 until new evidence changes the persisted artifacts.",
      "competing_hypothesis": "创新药 License-out may be a narrower branch event rather than a parent narrative transition.",
      "current_stage": "S5-S6",
      "prior_band": "medium",
      "posterior_direction": "unchanged",
      "event_intensity": "medium",
      "tail_structure": "normal",
      "strongest_evidence_ids": [
        "licenseout_parent_label",
        "licenseout_parent_capital",
        "licenseout_parent_pricing",
        "licenseout_parent_reality",
        "licenseout_e001"
      ],
      "why_not_higher_stage": "Upgrade is capped by required checks: reality-first path; pricing adoption through upfront/milestone/global rights; clinical and regulatory risk; milestone realization risk.",
      "falsification_trigger": "New persisted evidence contradicts the current stage or removes a required Stage Gate layer.",
      "next_validation_window": "4-6 weeks",
      "operator_agreement": "uncertain",
      "operator_comment": "Initial pilot seed; awaiting operator review.",
      "outcome_status": "pending",
      "latest_artifact_stage": "S5-S6",
      "diff_change_type": "no_change",
      "diff_detected_changes": [
        "no_change"
      ],
      "branch_mutation_detected": false,
      "missed_change_detected": false,
      "artifact_evidence_ids": [
        "licenseout_parent_label",
        "licenseout_parent_capital",
        "licenseout_parent_pricing",
        "licenseout_parent_reality",
        "licenseout_e001"
      ],
      "research_only_action": "wait",
      "status_note": "No change is a valid pilot state; continue the validation window."
    },
    {
      "topic_id": "ai_edge_applications",
      "current_hypothesis": "AI edge applications has observable research signals but still needs artifact-backed validation.",
      "competing_hypothesis": "AI edge applications may remain a local event cluster rather than a durable parent narrative.",
      "current_stage": "S3",
      "prior_band": "medium",
      "posterior_direction": "unchanged",
      "event_intensity": "low",
      "tail_structure": "right_tail_candidate",
      "strongest_evidence_ids": [],
      "why_not_higher_stage": "Pilot seed requires future Evidence Table support before any higher-stage claim.",
      "falsification_trigger": "No validated evidence appears during the pilot window or key assumptions are contradicted.",
      "next_validation_window": "4-6 weeks",
      "operator_agreement": "uncertain",
      "operator_comment": "Pilot seed; not yet linked to canonical artifacts.",
      "outcome_status": "pending",
      "latest_artifact_stage": null,
      "diff_change_type": null,
      "diff_detected_changes": [],
      "branch_mutation_detected": false,
      "missed_change_detected": false,
      "artifact_evidence_ids": [],
      "research_only_action": "observe",
      "status_note": "Pilot topic remains under observation."
    },
    {
      "topic_id": "synthetic_biology_tools",
      "current_hypothesis": "Synthetic biology tools has observable research signals but still needs artifact-backed validation.",
      "competing_hypothesis": "Synthetic biology tools may remain a local event cluster rather than a durable parent narrative.",
      "current_stage": "S2",
      "prior_band": "medium",
      "posterior_direction": "unchanged",
      "event_intensity": "low",
      "tail_structure": "right_tail_candidate",
      "strongest_evidence_ids": [],
      "why_not_higher_stage": "Pilot seed requires future Evidence Table support before any higher-stage claim.",
      "falsification_trigger": "No validated evidence appears during the pilot window or key assumptions are contradicted.",
      "next_validation_window": "4-6 weeks",
      "operator_agreement": "uncertain",
      "operator_comment": "Pilot seed; not yet linked to canonical artifacts.",
      "outcome_status": "pending",
      "latest_artifact_stage": null,
      "diff_change_type": null,
      "diff_detected_changes": [],
      "branch_mutation_detected": false,
      "missed_change_detected": false,
      "artifact_evidence_ids": [],
      "research_only_action": "observe",
      "status_note": "Pilot topic remains under observation."
    },
    {
      "topic_id": "solid_state_battery",
      "current_hypothesis": "Solid-state battery has observable research signals but still needs artifact-backed validation.",
      "competing_hypothesis": "Solid-state battery may remain a local event cluster rather than a durable parent narrative.",
      "current_stage": "S4",
      "prior_band": "medium",
      "posterior_direction": "unchanged",
      "event_intensity": "low",
      "tail_structure": "normal",
      "strongest_evidence_ids": [],
      "why_not_higher_stage": "Pilot seed requires future Evidence Table support before any higher-stage claim.",
      "falsification_trigger": "No validated evidence appears during the pilot window or key assumptions are contradicted.",
      "next_validation_window": "4-6 weeks",
      "operator_agreement": "uncertain",
      "operator_comment": "Pilot seed; not yet linked to canonical artifacts.",
      "outcome_status": "pending",
      "latest_artifact_stage": null,
      "diff_change_type": null,
      "diff_detected_changes": [],
      "branch_mutation_detected": false,
      "missed_change_detected": false,
      "artifact_evidence_ids": [],
      "research_only_action": "observe",
      "status_note": "Pilot topic remains under observation."
    },
    {
      "topic_id": "low_altitude_economy",
      "current_hypothesis": "Low-altitude economy has observable research signals but still needs artifact-backed validation.",